{
  "schema_version": "1.0.0",
  "record_type": "experiment-run",
  "system_id": "my-ai-system",
  "system_version": "1.2.0",
  "experiment_id": "EXP-001",
  "measure_id": "M-003",
  "timestamp": "2026-01-15T10:30:00Z",
  "collector": "automated",
  "n": 500,
  "value": 2.1,
  "target": 5.0,
  "comparison": "LE",
  "pass": true,
  "notes": "Hallucination rate measured across 500 queries on medical domain."
}
